二级分类名称,三级分类名称,四级分类名称,咨询单内容,提供方案,处理方式,咨询方式,一级分类名称
这边核实到之前的客服是已经给您进行私信回复呢关于您反馈的【快递物流】问题， 现核实为：【已经帮您反馈物流催促 】 这个是回复的内容呢
最新2023年4月30日 上午4:40:00 【西安市】 快件离开 【西安中转】 已发往 【乌鲁木齐中转】
一般下单48小时左右发货的
下单之后3-7个工作日发货的哦
这边提交商家催促下哦
查看到您的快件已暂存至成都市工人村便民服务站韵达快递超市
这边反馈商家处理下的哦
商品名称显示：预计4.30日起陆续发货的哈
是实物书籍，无法播放
查看页面告知活动是有赠送相关商品 先到先得
请提供兑换的页面截图亲
喜马拉雅售卖商品都是经过严格把关，由正规渠道采购均是全新，请您放心购买。
商品都是正品的呢，都是有质保的哦
但此页面无法修改 商品类型的哦  需要以页面显示为准的哦
提供下截图核实，
核实商品用户
一般是48小时的哦
发群 等待私信
这边帮您反馈商家核实下的核实后私信告知您结果
是的呢 目前下架 不能购买了哦
是哪款耳机的呢
已反馈商家
您好，您反馈的问题我们了解了，因为系统升级原因，暂时需要您手动打开附近的设备权限；打开步骤： 打开设置--->打开应用和服务--->打开应用管理--->找到喜马拉雅--->点击权限--->点击附近的设备--->先禁止再允许---->重启APP再次尝试
临近五一，售后处理可能延迟假期后，您可以节后，联系我们咨询进度哦
目前已过保了哦 可以付费换新 90元的
小喜这边看到您的退款已经在审核中的 这边也会催促商家这边尽快核实确认
辛苦您耐心等待我们这边签收1-2个工作日联系咨询售后情况的哦
核实后私信告知您结果
建议您后续留意物流更新的，物流更新显示这边签收之后退款的哦
